{
  "approval": {
    "reason": null,
    "reviewer": null,
    "status": "not_reviewed"
  },
  "baseProposalSha256": "0867a3198f1d38412ef1e985979f55332a25d28222e77648b0e7d75fc9f9c708",
  "contacts": null,
  "entryId": "set_a_pose_007",
  "extensions": {},
  "landmarks": {},
  "orientation": null,
  "schemaVersion": "2d-doll-pose-corpus-override-0.1",
  "sourceCleanup": []
}
