{
  "approval": {
    "reason": null,
    "reviewer": null,
    "status": "not_reviewed"
  },
  "baseProposalSha256": "bc9d96909a566d78d94768e9a8dc9faffdbe325cb8a76541042d67243206caf2",
  "contacts": null,
  "entryId": "set_c_pose_012",
  "extensions": {},
  "landmarks": {},
  "orientation": null,
  "schemaVersion": "2d-doll-pose-corpus-override-0.1",
  "sourceCleanup": []
}
