{
  "approval": {
    "reason": null,
    "reviewer": null,
    "status": "not_reviewed"
  },
  "baseProposalSha256": "70a6883d8a0d8f794cb1651617917ff3c5e75ee9446031f214f0302da66046bf",
  "contacts": null,
  "entryId": "set_a_pose_021",
  "extensions": {},
  "landmarks": {},
  "orientation": null,
  "schemaVersion": "2d-doll-pose-corpus-override-0.1",
  "sourceCleanup": []
}
