{
  "approval": {
    "reason": null,
    "reviewer": null,
    "status": "not_reviewed"
  },
  "baseProposalSha256": "793d540dd97fd3bd2c123fc2618861e09c087150eea896c56722a16826dfdb99",
  "contacts": null,
  "entryId": "set_b_pose_009",
  "extensions": {},
  "landmarks": {},
  "orientation": null,
  "schemaVersion": "2d-doll-pose-corpus-override-0.1",
  "sourceCleanup": []
}
