{
  "approval": {
    "reason": null,
    "reviewer": null,
    "status": "not_reviewed"
  },
  "baseProposalSha256": "acb7b14aeee68b8549460da35cd84e866713f5cae9ae71f821e0c46caba47391",
  "contacts": null,
  "entryId": "set_c_pose_035",
  "extensions": {},
  "landmarks": {},
  "orientation": null,
  "schemaVersion": "2d-doll-pose-corpus-override-0.1",
  "sourceCleanup": []
}
