{
  "approval": {
    "reason": null,
    "reviewer": null,
    "status": "not_reviewed"
  },
  "baseProposalSha256": "244dc2ec69da8405242b36b58abc6fc25a132e3c1af0242672ccdcb6f74ebfe8",
  "contacts": null,
  "entryId": "set_c_pose_016",
  "extensions": {},
  "landmarks": {},
  "orientation": null,
  "schemaVersion": "2d-doll-pose-corpus-override-0.1",
  "sourceCleanup": []
}
