{
  "approval": {
    "reason": null,
    "reviewer": null,
    "status": "not_reviewed"
  },
  "baseProposalSha256": "3991693c36de1d75e13af44854691c88b180c4639f57d5718d4ad17cd62cb0bb",
  "contacts": null,
  "entryId": "set_b_pose_005",
  "extensions": {},
  "landmarks": {},
  "orientation": null,
  "schemaVersion": "2d-doll-pose-corpus-override-0.1",
  "sourceCleanup": []
}
