{
  "approval": {
    "reason": null,
    "reviewer": null,
    "status": "not_reviewed"
  },
  "baseProposalSha256": "70526d58511180bd1953280f8dbf42064b30df56ee829272eb892feb6f7aa5dc",
  "contacts": null,
  "entryId": "set_b_pose_047",
  "extensions": {},
  "landmarks": {},
  "orientation": null,
  "schemaVersion": "2d-doll-pose-corpus-override-0.1",
  "sourceCleanup": []
}
