{
  "approval": {
    "reason": null,
    "reviewer": null,
    "status": "not_reviewed"
  },
  "baseProposalSha256": "0aede22a1893645460b6b2997853ed448051fb1d25c5eda3866393050032a995",
  "contacts": null,
  "entryId": "set_b_pose_016",
  "extensions": {},
  "landmarks": {},
  "orientation": null,
  "schemaVersion": "2d-doll-pose-corpus-override-0.1",
  "sourceCleanup": []
}
